{
  "Evidence ID": "E0066",
  "Title": "Standardised Audit Evidence Pack for TREs",
  "Description": "",
  "Checksum": "",
  "Timestamp": "",
  "Signed file": "",
  "Evidence Date": "",
  "Evidence Type": "DOC",
  "Evidence Maturity": "Process",
  "Responsible Actor": "TRE Manager",
  "Scope Attribution": "",
  "Architecture-specific": "No",
  "Expected Validation Approach": "Manual Review",
  "Validation Notes": "",
  "Related Requirement ID(s)": [
    "R004"
  ],
  "Related Requirements Summary": [],
  "Notes": ""
}