{
  "Evidence ID": "E0089",
  "Title": "A persistent, publicly resolvable landing page associated with the PID that exposes machine- and human-readable metadata, indexed by internal catalogues and external discovery services.",
  "Description": "",
  "Checksum": "",
  "Timestamp": "",
  "Signed file": "",
  "Evidence Date": "",
  "Evidence Type": "DOC",
  "Evidence Maturity": "Process",
  "Responsible Actor": "Data Steward",
  "Scope Attribution": "",
  "Architecture-specific": "Yes",
  "Expected Validation Approach": "Automated Check",
  "Validation Notes": "",
  "Related Requirement ID(s)": [
    "R011"
  ],
  "Related Requirements Summary": [],
  "Notes": ""
}