{
  "Evidence ID": "E0006",
  "Title": "MFA configuration export from identity access management solution (e.g., Keycloak)",
  "Description": "",
  "Checksum": "",
  "Timestamp": "",
  "Signed file": "",
  "Evidence Date": "",
  "Evidence Type": "TECH",
  "Evidence Maturity": "Policy",
  "Responsible Actor": "Identity & Access Manager",
  "Scope Attribution": "",
  "Architecture-specific": "No",
  "Expected Validation Approach": "Manual Review",
  "Validation Notes": "",
  "Related Requirement ID(s)": [
    "R024"
  ],
  "Related Requirements Summary": [],
  "Notes": ""
}