{
  "Evidence ID": "E0068",
  "Title": "Standardised DTA Templates per Data Type",
  "Description": "",
  "Checksum": "",
  "Timestamp": "",
  "Signed file": "",
  "Evidence Date": "",
  "Evidence Type": "GOV",
  "Evidence Maturity": "Policy",
  "Responsible Actor": "Legal Officer",
  "Scope Attribution": "",
  "Architecture-specific": "No",
  "Expected Validation Approach": "Manual Review",
  "Validation Notes": "",
  "Related Requirement ID(s)": [
    "R020"
  ],
  "Related Requirements Summary": [],
  "Notes": ""
}