{
  "Evidence ID": "E0123",
  "Title": "Workflow diagram for TREs services access\n\nDesign diagram to analyze access control",
  "Description": "",
  "Checksum": "",
  "Timestamp": "",
  "Signed file": "",
  "Evidence Date": "",
  "Evidence Type": "TECH",
  "Evidence Maturity": "",
  "Responsible Actor": "Identity & Access Manager",
  "Scope Attribution": "",
  "Architecture-specific": "Yes",
  "Expected Validation Approach": "",
  "Validation Notes": "",
  "Related Requirement ID(s)": [
    "R033"
  ],
  "Related Requirements Summary": [],
  "Notes": ""
}