{
  "Evidence ID": "E0028",
  "Title": "Technical Controls Enforcing Approved Data Imports Only",
  "Description": "",
  "Checksum": "",
  "Timestamp": "",
  "Signed file": "",
  "Evidence Date": "",
  "Evidence Type": "TECH",
  "Evidence Maturity": "Technical",
  "Responsible Actor": "Technical Administrator",
  "Scope Attribution": "",
  "Architecture-specific": "No",
  "Expected Validation Approach": "Manual Review",
  "Validation Notes": "",
  "Related Requirement ID(s)": [
    "R049"
  ],
  "Related Requirements Summary": [],
  "Notes": ""
}