{
  "Evidence ID": "E0014",
  "Title": "Project Role-Based Access (RBAC) Definition. A document defining standard \"Research Personas\" (e.g., Analyst vs. Principal Investigator) and their pre-approved permission levels.",
  "Description": "",
  "Checksum": "",
  "Timestamp": "",
  "Signed file": "",
  "Evidence Date": "",
  "Evidence Type": "DOC",
  "Evidence Maturity": "Policy",
  "Responsible Actor": "TRE Manager",
  "Scope Attribution": "",
  "Architecture-specific": "No",
  "Expected Validation Approach": "Manual Review",
  "Validation Notes": "",
  "Related Requirement ID(s)": [
    "R052"
  ],
  "Related Requirements Summary": [],
  "Notes": ""
}