{
  "Evidence ID": "E0082",
  "Title": "Presence on a list of registered safe researchers",
  "Description": "",
  "Checksum": "",
  "Timestamp": "",
  "Signed file": "",
  "Evidence Date": "",
  "Evidence Type": "COMPL",
  "Evidence Maturity": "Process",
  "Responsible Actor": "Data Protection Officer",
  "Scope Attribution": "",
  "Architecture-specific": "No",
  "Expected Validation Approach": "Periodic Audit",
  "Validation Notes": "",
  "Related Requirement ID(s)": [
    "R014"
  ],
  "Related Requirements Summary": [],
  "Notes": ""
}