{
  "Evidence ID": "E0040",
  "Title": "Project Submission & Approval Workflow with Embedded Governance Gates",
  "Description": "",
  "Checksum": "",
  "Timestamp": "",
  "Signed file": "",
  "Evidence Date": "",
  "Evidence Type": "DOC",
  "Evidence Maturity": "Process",
  "Responsible Actor": "Data Access Officer",
  "Scope Attribution": "",
  "Architecture-specific": "No",
  "Expected Validation Approach": "Manual Review",
  "Validation Notes": "",
  "Related Requirement ID(s)": [
    "R057"
  ],
  "Related Requirements Summary": [],
  "Notes": ""
}