{
  "Evidence ID": "E0071",
  "Title": "DTA Approval and Version Control Process",
  "Description": "",
  "Checksum": "",
  "Timestamp": "",
  "Signed file": "",
  "Evidence Date": "",
  "Evidence Type": "OPS",
  "Evidence Maturity": "Process",
  "Responsible Actor": "Data Steward",
  "Scope Attribution": "",
  "Architecture-specific": "No",
  "Expected Validation Approach": "Manual Review",
  "Validation Notes": "",
  "Related Requirement ID(s)": [
    "R020"
  ],
  "Related Requirements Summary": [],
  "Notes": ""
}