{
  "Evidence ID": "E0017",
  "Title": "Documentation of configuration and system security settings demonstrating that encryption at rest is enabled for all data stored within the Trusted Research Environment, including database encryption, file system encryption, and key management configuration. Supporting evidence may include screenshots, configuration files, or audit logs confirming active encryption and compliance with approved encryption standards.",
  "Description": "",
  "Checksum": "",
  "Timestamp": "",
  "Signed file": "",
  "Evidence Date": "",
  "Evidence Type": "OPS",
  "Evidence Maturity": "Policy",
  "Responsible Actor": "TRE Operations Officer",
  "Scope Attribution": "",
  "Architecture-specific": "No",
  "Expected Validation Approach": "Periodic Audit",
  "Validation Notes": "",
  "Related Requirement ID(s)": [
    "R008"
  ],
  "Related Requirements Summary": [],
  "Notes": ""
}