{
  "Evidence ID": "E0025",
  "Title": "SLA describing the required A/R values",
  "Description": "",
  "Checksum": "",
  "Timestamp": "",
  "Signed file": "",
  "Evidence Date": "",
  "Evidence Type": "",
  "Evidence Maturity": "",
  "Responsible Actor": "",
  "Scope Attribution": "",
  "Architecture-specific": "",
  "Expected Validation Approach": "",
  "Validation Notes": "",
  "Related Requirement ID(s)": [
    "R041"
  ],
  "Related Requirements Summary": [],
  "Notes": ""
}