{
  "Evidence ID": "E0007",
  "Title": "User Onboarding & Offboarding Policy: A formal document stating that all accounts must be created via the central registry and linked to a verified identity.",
  "Description": "",
  "Checksum": "",
  "Timestamp": "",
  "Signed file": "",
  "Evidence Date": "",
  "Evidence Type": "COMPL",
  "Evidence Maturity": "Policy",
  "Responsible Actor": "Data Protection Officer",
  "Scope Attribution": "",
  "Architecture-specific": "No",
  "Expected Validation Approach": "Manual Review",
  "Validation Notes": "",
  "Related Requirement ID(s)": [
    "R045"
  ],
  "Related Requirements Summary": [],
  "Notes": ""
}